{
  "sessionId": "ses_fixture_normal",
  "outcome": "CLOSED",
  "policyHash": "sha256:0fa81a98b90a317baf33b20bd55401cf63f27f9a1dc7e5cb439237f564605ed6",
  "calls": 3,
  "usageChargedAtomic": "3000",
  "bondRefundedAtomic": "1000000",
  "penaltyAtomic": "0",
  "transactions": [
    {"kind": "PAYMENT", "status": "CONFIRMED", "providerReference": "fake-usage:ses_fixture_normal", "fixtureMarker": "FAKE_ADAPTER_FIXTURE"},
    {"kind": "BOND", "status": "CONFIRMED", "providerReference": "fake-bond-refund:ses_fixture_normal", "fixtureMarker": "FAKE_ADAPTER_FIXTURE"}
  ],
  "receiptHash": "sha256:fixture-normal-receipt"
}
